{
  "schemaVersion": "1.0.0",
  "manifestVersion": "2026.06.30.1",
  "effectiveDate": "2026-06-30",
  "scope": {
    "reference": "2026年6月30日北京轨道交通官方线路图：纳入地铁、机场线和有轨电车，不含市郊铁路",
    "includedServiceTypes": ["metro", "airport", "tram"],
    "excludedServiceTypes": ["suburban_rail"]
  },
  "lines": [
    { "id": "line-1", "nameZh": "1号线", "serviceType": "metro", "topology": "linear", "color": "#A4343A", "wikipediaPageTitle": "北京地铁1号线", "snapshotFile": "line-1.html", "statisticsPolicy": { "includeInStationCoverage": true, "includeInMileage": true, "includeInCompletion": true } },
    { "id": "line-batong", "nameZh": "八通线", "serviceType": "metro", "topology": "linear", "color": "#A4343A", "wikipediaPageTitle": "北京地铁八通线", "snapshotFile": "line-batong.html", "statisticsPolicy": { "includeInStationCoverage": true, "includeInMileage": true, "includeInCompletion": true } },
    { "id": "line-2", "nameZh": "2号线", "serviceType": "metro", "topology": "circular", "color": "#004B87", "wikipediaPageTitle": "北京地铁2号线", "snapshotFile": "line-2.html", "statisticsPolicy": { "includeInStationCoverage": true, "includeInMileage": true, "includeInCompletion": true } },
    { "id": "line-3", "nameZh": "3号线", "serviceType": "metro", "topology": "linear", "color": "#D90627", "wikipediaPageTitle": "北京地铁3号线", "snapshotFile": "line-3.html", "statisticsPolicy": { "includeInStationCoverage": true, "includeInMileage": true, "includeInCompletion": true } },
    { "id": "line-4", "nameZh": "4号线", "serviceType": "metro", "topology": "linear", "color": "#008C95", "wikipediaPageTitle": "北京地铁4号线", "snapshotFile": "line-4.html", "statisticsPolicy": { "includeInStationCoverage": true, "includeInMileage": true, "includeInCompletion": true } },
    { "id": "line-daxing", "nameZh": "大兴线", "serviceType": "metro", "topology": "linear", "color": "#008C95", "wikipediaPageTitle": "北京地铁大兴线", "snapshotFile": "line-daxing.html", "statisticsPolicy": { "includeInStationCoverage": true, "includeInMileage": true, "includeInCompletion": true } },
    { "id": "line-5", "nameZh": "5号线", "serviceType": "metro", "topology": "linear", "color": "#AA0061", "wikipediaPageTitle": "北京地铁5号线", "snapshotFile": "line-5.html", "statisticsPolicy": { "includeInStationCoverage": true, "includeInMileage": true, "includeInCompletion": true } },
    { "id": "line-6", "nameZh": "6号线", "serviceType": "metro", "topology": "linear", "color": "#B58500", "wikipediaPageTitle": "北京地铁6号线", "snapshotFile": "line-6.html", "statisticsPolicy": { "includeInStationCoverage": true, "includeInMileage": true, "includeInCompletion": true } },
    { "id": "line-7", "nameZh": "7号线", "serviceType": "metro", "topology": "linear", "color": "#FFC56E", "wikipediaPageTitle": "北京地铁7号线", "snapshotFile": "line-7.html", "statisticsPolicy": { "includeInStationCoverage": true, "includeInMileage": true, "includeInCompletion": true } },
    { "id": "line-8", "nameZh": "8号线", "serviceType": "metro", "topology": "linear", "color": "#009B77", "wikipediaPageTitle": "北京地铁8号线", "snapshotFile": "line-8.html", "statisticsPolicy": { "includeInStationCoverage": true, "includeInMileage": true, "includeInCompletion": true } },
    { "id": "line-9", "nameZh": "9号线", "serviceType": "metro", "topology": "linear", "color": "#97D700", "wikipediaPageTitle": "北京地铁9号线", "snapshotFile": "line-9.html", "statisticsPolicy": { "includeInStationCoverage": true, "includeInMileage": true, "includeInCompletion": true } },
    { "id": "line-10", "nameZh": "10号线", "serviceType": "metro", "topology": "circular", "color": "#0092BC", "wikipediaPageTitle": "北京地铁10号线", "snapshotFile": "line-10.html", "statisticsPolicy": { "includeInStationCoverage": true, "includeInMileage": true, "includeInCompletion": true } },
    { "id": "line-11", "nameZh": "11号线", "serviceType": "metro", "topology": "linear", "color": "#FF8674", "wikipediaPageTitle": "北京地铁11号线", "snapshotFile": "line-11.html", "statisticsPolicy": { "includeInStationCoverage": true, "includeInMileage": true, "includeInCompletion": true } },
    { "id": "line-12", "nameZh": "12号线", "serviceType": "metro", "topology": "linear", "color": "#9C4F01", "wikipediaPageTitle": "北京地铁12号线", "snapshotFile": "line-12.html", "statisticsPolicy": { "includeInStationCoverage": true, "includeInMileage": true, "includeInCompletion": true } },
    { "id": "line-13", "nameZh": "13号线", "serviceType": "metro", "topology": "linear", "color": "#F4DA40", "wikipediaPageTitle": "北京地铁13号线", "snapshotFile": "line-13.html", "statisticsPolicy": { "includeInStationCoverage": true, "includeInMileage": true, "includeInCompletion": true } },
    { "id": "line-14", "nameZh": "14号线", "serviceType": "metro", "topology": "linear", "color": "#CA9A8E", "wikipediaPageTitle": "北京地铁14号线", "snapshotFile": "line-14.html", "statisticsPolicy": { "includeInStationCoverage": true, "includeInMileage": true, "includeInCompletion": true } },
    { "id": "line-15", "nameZh": "15号线", "serviceType": "metro", "topology": "linear", "color": "#653279", "wikipediaPageTitle": "北京地铁15号线", "snapshotFile": "line-15.html", "statisticsPolicy": { "includeInStationCoverage": true, "includeInMileage": true, "includeInCompletion": true } },
    { "id": "line-16", "nameZh": "16号线", "serviceType": "metro", "topology": "linear", "color": "#6BA539", "wikipediaPageTitle": "北京地铁16号线", "snapshotFile": "line-16.html", "statisticsPolicy": { "includeInStationCoverage": true, "includeInMileage": true, "includeInCompletion": true } },
    { "id": "line-17", "nameZh": "17号线", "serviceType": "metro", "topology": "linear", "color": "#00ABAB", "wikipediaPageTitle": "北京地铁17号线", "snapshotFile": "line-17.html", "statisticsPolicy": { "includeInStationCoverage": true, "includeInMileage": true, "includeInCompletion": true } },
    { "id": "line-18", "nameZh": "18号线", "serviceType": "metro", "topology": "linear", "color": "#685BC7", "wikipediaPageTitle": "北京地铁18号线", "snapshotFile": "line-18.html", "statisticsPolicy": { "includeInStationCoverage": true, "includeInMileage": true, "includeInCompletion": true } },
    { "id": "line-19", "nameZh": "19号线", "serviceType": "metro", "topology": "linear", "color": "#D3A3C9", "wikipediaPageTitle": "北京地铁19号线", "snapshotFile": "line-19.html", "statisticsPolicy": { "includeInStationCoverage": true, "includeInMileage": true, "includeInCompletion": true } },
    { "id": "line-yizhuang", "nameZh": "亦庄线", "serviceType": "metro", "topology": "linear", "color": "#D0006F", "wikipediaPageTitle": "北京地铁亦庄线", "snapshotFile": "line-yizhuang.html", "statisticsPolicy": { "includeInStationCoverage": true, "includeInMileage": true, "includeInCompletion": true } },
    { "id": "line-fangshan", "nameZh": "房山线", "serviceType": "metro", "topology": "linear", "color": "#D86018", "wikipediaPageTitle": "北京地铁房山线", "snapshotFile": "line-fangshan.html", "statisticsPolicy": { "includeInStationCoverage": true, "includeInMileage": true, "includeInCompletion": true } },
    { "id": "line-yanfang", "nameZh": "燕房线", "serviceType": "metro", "topology": "linear", "color": "#D86018", "wikipediaPageTitle": "北京地铁燕房线", "snapshotFile": "line-yanfang.html", "statisticsPolicy": { "includeInStationCoverage": true, "includeInMileage": true, "includeInCompletion": true } },
    { "id": "line-changping", "nameZh": "昌平线", "serviceType": "metro", "topology": "linear", "color": "#D986BA", "wikipediaPageTitle": "北京地铁昌平线", "snapshotFile": "line-changping.html", "statisticsPolicy": { "includeInStationCoverage": true, "includeInMileage": true, "includeInCompletion": true } },
    { "id": "line-s1", "nameZh": "S1线", "serviceType": "metro", "topology": "linear", "color": "#A45A2A", "wikipediaPageTitle": "北京地铁S1线", "snapshotFile": "line-s1.html", "statisticsPolicy": { "includeInStationCoverage": true, "includeInMileage": true, "includeInCompletion": true } },
    { "id": "capital-airport-express", "nameZh": "首都机场线", "serviceType": "airport", "topology": "special", "color": "#A192B2", "wikipediaPageTitle": "北京地铁首都机场线", "snapshotFile": "capital-airport-express.html", "statisticsPolicy": { "includeInStationCoverage": true, "includeInMileage": true, "includeInCompletion": true, "specialRule": "capital-airport-combination-v1" } },
    { "id": "daxing-airport-express", "nameZh": "大兴机场线", "serviceType": "airport", "topology": "linear", "color": "#0049A5", "wikipediaPageTitle": "北京地铁大兴机场线", "snapshotFile": "daxing-airport-express.html", "statisticsPolicy": { "includeInStationCoverage": true, "includeInMileage": true, "includeInCompletion": true } },
    { "id": "line-xijiao", "nameZh": "西郊线", "serviceType": "tram", "topology": "linear", "color": "#D22630", "wikipediaPageTitle": "北京地铁西郊线", "snapshotFile": "line-xijiao.html", "statisticsPolicy": { "includeInStationCoverage": true, "includeInMileage": true, "includeInCompletion": true } },
    { "id": "line-yizhuang-t1", "nameZh": "亦庄T1线", "serviceType": "tram", "topology": "linear", "color": "#D22630", "wikipediaPageTitle": "北京亦庄新城现代有轨电车T1线", "snapshotFile": "line-yizhuang-t1.html", "statisticsPolicy": { "includeInStationCoverage": true, "includeInMileage": true, "includeInCompletion": true } }
  ],
  "throughServices": [
    { "id": "through-line-1-batong", "nameZh": "1号线—八通线贯通运营", "lineIds": ["line-1", "line-batong"], "connectionStationNameZh": "四惠东" },
    { "id": "through-line-4-daxing", "nameZh": "4号线—大兴线贯通运营", "lineIds": ["line-4", "line-daxing"], "connectionStationNameZh": "公益西桥" }
  ]
}
